<?xml version="1.0" encoding="UTF-8"?>
<!DOCTYPE softwarecomponent PUBLIC "-//JTRS//DTD SCA V2.2.2 SCD//EN" "softwarecomponent.dtd">
<softwarecomponent>
    <corbaversion>2.2</corbaversion>
    <componentrepid repid="IDL:CF/Resource:1.0"/>
    <componenttype>resource</componenttype>
    <componentfeatures>
        <supportsinterface supportsname="Resource" repid="IDL:CF/Resource:1.0"/>
        <supportsinterface supportsname="LifeCycle" repid="IDL:CF/LifeCycle:1.0"/>
        <supportsinterface supportsname="PortSupplier" repid="IDL:CF/PortSupplier:1.0"/>
        <supportsinterface supportsname="PropertySet" repid="IDL:CF/PropertySet:1.0"/>
        <supportsinterface supportsname="IDL:CF/TestableObject:1.0" repid="TestableObject"/>
        <ports/>
    </componentfeatures>
    <interfaces>
        <interface name="Resource" repid="IDL:CF/Resource:1.0">
            <inheritsinterface repid="IDL:CF/LifeCycle:1.0"/>
            <inheritsinterface repid="IDL:CF/PortSupplier:1.0"/>
            <inheritsinterface repid="IDL:CF/PropertySet:1.0"/>
            <inheritsinterface repid="IDL:CF/TestableObject:1.0"/>
        </interface>
        <interface name="LifeCycle" repid="IDL:CF/LifeCycle:1.0"/>
        <interface name="PortSupplier" repid="IDL:CF/PortSupplier:1.0"/>
        <interface name="PropertySet" repid="IDL:CF/PropertySet:1.0"/>
        <interface name="TestableObject" repid="IDL:CF/TestableObject:1.0"/>
        <interface name="ProvidesPortStatisticsProvider" repid="IDL:BULKIO/ProvidesPortStatisticsProvider:1.0"/>
        <interface name="updateSRI" repid="IDL:BULKIO/updateSRI:1.0"/>
    </interfaces>
</softwarecomponent>
